<!ELEMENT menugroup (menu*)>

<!ELEMENT menu (menu*)>

<!ATTLIST menugroup orientation CDATA "hbr">

<!ATTLIST menu icon CDATA "">
<!ATTLIST menu title CDATA "">
<!ATTLIST menu url CDATA "">
<!ATTLIST menu target CDATA "">
<!ATTLIST menu description CDATA "">